teks	label_klaster
tukar perkara sedia gaji rendah pasal jawat kembang resume sedia tukar	2
kembang karir hasil sesuai harap faktur utama tahan perut hati otak	2
tukar perkara sedia gaji rendah pasal jawat kembang resume sedia tukar	2
alas mumpuni karier kontribusi kembang	2
harap coba kembang beda cari suasana tantang alam luas	2
loyalitas hasil sesuai tawar gaji bangun sulit kembang	2
tukar perkara sedia gaji rendah pasal jawat kembang resume sedia tukar	2
alas gaji orang gaji kembang lingkung sesal arti	2
pikir kembang sehat pilih pilih	2
alas henti kembang bosan cari hobi bikin kembang bikin semangat	2
kantor bagus banget enak kompak jahat gaji seret karir kembang situ alas teman enak cari kayak	2
alas tindak laku cari alam cari peluang sesuai tuju karir ahli kembang	2
kembang karir hasil sesuai harap faktur utama tahan perut hati otak	2
bismillah coba rangkum sederhana paham merger akuisisi sektor bisnis kecuali industri malu agens kembang	2
cabut manager peka karir kembang kompensasi belit kasi ajar apresiasi mentor kultur sehat ruang inovasi	2
harap coba kembang beda cari suasana tantang alam luas	2
usaha ganti mesin laku alas manusia tangan usaha kembang semangat panjenengan	2
pengin industri kembang coba perhati jual	2
alas lamar kembang peduli kembang lihat tenang lihat loyal pengin ganti penuh	2
dunia kembang arah revolusi industri hidup binatang libur tunjang santai minum sampanye restoran mewah	2
mentoring curhat kembang bantu	2
kantor bagus banget enak kompak jahat gaji seret karir kembang situ alas teman enak cari kayak	2
usaha jelek bikin kembang doang proses ajeg capek jelek terima hikmah doang cari bagus	2
pegang divisi tahan cuman alas kembang ilmu karir terima jepang usaha	2
alas tindak laku cari alam cari peluang sesuai tuju karir ahli kembang	2
alas terang alternatif lingkung jahat cari lingkung dukung kembang tumbuh kembang profesional	2
alas kembang kontrak pakai bilang	2
sebel orang selesai potensi ketemu orang sikap hadap ajar kembang interpersonal	2
alas tawar gaji kultur koneksi potensi kembang potensi laku alas orang betah	2
alas lamar kembang peduli kembang lihat tenang lihat loyal pengin ganti penuh	2
putus cowok kenal kemarin hidup niat kembang alas nyata	2
karyawan habis susah beritahu alas habis bentak cari kembang	2
masuk galau tinggal anak lihat orang orang banget lihat kembang anak menang lihat moga paham alas	2
kantor bagus banget enak kompak jahat gaji seret karir kembang situ alas teman enak cari kayak	2
tanda timbang kronis beranta lingkung rekan jahat kembang usaha jalan	2
alas terang alternatif lingkung jahat cari lingkung dukung kembang tumbuh kembang profesional	2
alas jahat milik jaga profesionalisme positif bicara kembang ajar cari tantang	2
alas terima kantor kantor telat bayar gaji kantor ganti sulit kasih alas situ kembang	2
alas tindak laku cari alam cari peluang sesuai tuju karir ahli kembang	2
kembang modal kota ambil alas visa negara	2
tukar perkara sedia gaji rendah pasal jawat kembang resume sedia tukar	2
kembang karir hasil sesuai harap faktur utama tahan perut hati otak	2
tukar perkara sedia gaji rendah pasal jawat kembang resume sedia tukar	2
loyalitas hasil sesuai tawar gaji bangun sulit kembang	2
pikir kembang sehat pilih pilih	2
usaha bilang cari bikin kembang buruk mending	2
sangka lingkung jahat jatuh karya hidup puji melulu ujung sehat nyaman malas kembang mesti imbang	2
orang lihat asil lihat ruang lingkup pribadi ruang lingkup kembang bayang ruang lingkup jahat maju pikir otak selesai	2
jahat kembang orang	2
jahat titik capek hubung kembang alias situasi sisa tuduh kali ribut sayang egois dominasi hubung putus masuk	2
kantor jahat rupa rejeki terkadang kantor jahat kembang cocok pulang ambil gaji	2
lingkung rekan jahat dukung kembang ambil keluarga harap perfek lumayan	2
