teks	label_klaster
nyata posisi gambar kursi pengaruh banget semenjak meja kasur jatuh kayak leseh ganti kursi sakit pinggang	0
tiada gaji urus beban wang sehat rupa faktor henti	0
rekomendasi managemen pasar salah bidang milik pengaruh usaha rekan kasih	0
ganggu jabat hormat rehat komunikasi tempoh akta sekira majikan bayar	0
peran milik andil karyawan latar kuat orang gaji gain koneksi bikin kena sasar	0
pinda akta september cuti salin cuti kena ambil	0
cipta omnibus jalan capai oktober tingkat tajam omnibus sejati cipta negara oligarki mudah sangon upah murah privatisasi hubung buruh	0
ramai henti gaji harga kawan jahat beban repek kebaji abai	0
kantor bikin gaji cepat strategi jangka buah utas perspektif usaha hadap	0
gaji bawa pulang gaji doang anak muda rugi usaha bawa pulang monitor inventaris kantor biar untung	0
minggu september pinda akta kenal atur fleksibel mohon rumah situasi desak	0
kantor lembur bayar pulang malam buah budaya haram hukum pulang pabrik pulang karyawan pulang ganti	0
jabodetabek wajar alias kutu loncat gaji daerah lapang batas rendah coba	0
orang suka banget zona nyaman perihal cari nyaman gaji butuh lingkung suruh cari tolong kasih paham	0
lompat lompat relatif stabil cetak badai reda asik goreng gaji kena	0
ramai henti gaji harga kawan jahat beban repek kebaji abai	0
kuat kuasa pinda akta tangguh januari ubah akta kena kait cuti salin gaji jangka laksana september	0
dunia kantor salah pecat hilang gaji hilang nyawa tugas gaji enak	0
wajar arsenal arsenal main pengaruh latih uang transfer gaji salah latih medioker	0
skala luas bukti beranta pengaruh buruk performa making profesi taruh nyawa jaman tidur bodoh egois	0
cewek pulang sore galak main sabtu masuk tanggal merah masuk jarak rumah kantor takut tanggap	0
laksana patut kuat kuasa september tangguh cuti salin cuti minggu lepas raja putus pinda akta tangguh januari	0
wacana buah bibir sorot kerap pergok contoh	0
kantor pulang cepat kayak pulang gila banget bayang pulang jalan jakarta macet parah buka telat buka jalan rumah hebat banget kantor kayak	0
kena tukar gaji kena lihat faktor peluang staf staf cuti kena angkut isteri angkut senarai	0
lompat kenal kawan sorang lompat tukar tukar baju gaji	0
padang jawa	0
ramai cakap zone gain basic bosan contoh pasal gaji pasal suka takut	0
jawat awam putus henti nasihat henti alas sayang jamin takut niaga	0
cerita pecat karyawan tonton bingung lucu marah	0
masuk gaji orang were	0
ramai henti gaji harga kawan jahat beban repek kebaji abai	0
habis tolak alas nasib omset cabang pegang sender capek banget cabang penuh orang jahat gaji pokok sender omset	0
paham jamin gaji pangkat kena lompat	0
halo sender kantor alhamdulillah langsung gaji kantor menang hasil	0
usaha lokal indonesia prinsip wajar batas usaha gaji beda maksimal usaha harga upaya	0
gaji pengaruh banget nyaman teman lumayan goyah pengin	0
cewek gaji aneh usaha salah over kasih gaji biar pikir capek ajar	0
cewek gaji slip gaji dampak gaji usaha gaji usaha slip gaji ubah pikir	0
paksa modern bebas undur tunggu anggap tahan usaha wajib asih makan siang lembur minggu kasih kompensasi libur atur negeri manusiawi banding atur	0
palu gaji orang alami akibat cemas depresi ganggu aspek hidup pribadi bayang berat hidup	0
tukar gaji ramai tuju tukar kaya majikan sahaja kaya	0
tukar gaji ramai tuju tukar kaya majikan sahaja kaya	0
wajar tukar gaji loyal gaji tengok contoh situasi	0
buah syarikat rugi gaji minimum	0
kait kutu loncat manajemen loncat bikin gaji drastis baca kutu loncat rekomendasi kasih orang kandidat	0
usaha jahat julid salah anak bumn gaji sopan anak jaman	0
gaji gaji gaji	0
cuti ganti takut bilang alay rekan kantor ganti hubung orang kontak	0
utama masuk gaji pakai orang indonesia indonesia gaji habis hidup	0
jalan penat rumah	0
jakarta gaji tawar mutasi ponorogo gaji jakarta ponorogo murah ambil	0
salah ajar perkara gaji jahat peluang pangkat tukar	0
pergi jabat sahaja utama anak nikmat tukar ganti nikmat alhamdulillah	0
paksa masuk pagi pulang malam buta hukum telat balas pesan menit paksa lepas alat kena sakit paksa tidur kaki tangan hilang	0
kayak rame generalisasi baca sisi positif kutu loncat posisi gaji	0
rela alas usaha banget rumah gaji ongkos transpor rupiah sesal enak	0
real jalan mesin karyawan jalan mesin karyawan tinggal orang arti karyawan pegang gaji	0
teman kakak rekrut posisi bikin gaji kakak nyata gaji beda kakak segi gaji fasilitas beda akomodasi tiket cuti tanggung usaha	0
lingkung sehat manusiawi kompeten lokasi jangkau transportasi publik rumah cuti cuti gaji over rendah amin	0
alas urgen tawar jahat orang loyal terima usaha kutu loncat	0
gaji sesuai harap jahat gaji nyaman	0
jahat ekosistem keras kepala rugi mending cari laku aktivitas peluang jujur usaha pintu buka	0
alhamdulillah sekian tahan jahat potong gaji hidup real	0
negatif marah malas pergi teruk kaki bawang kipas gaji kaki bawang ubah perangai orang	0
fikir gaji suasana jenis jahat jenis takboleh kerjasama orang kepala auto malas	0
gaji digit rambut rontok bolak psikiater jahat bolak pabrik tidur fitnah teman katai orang	0
bimbang jahat gaji masuk gaji	0
syukur banget jahat gaji masuk main gaji tanggal tanggal gaji kasi kasih gila kasih	0
alami gaji sikit kawan gaji kawan jahat	0
gaji lingkung enak nyaman gaji nyaman baca jahat	0
admin gaji motor pakai operasional jahat kali berangkat menang patut saran	0
cari duit cari teman real artikel teman rekan	0
admin henti zaman hilang hilang akal gila jahat henti span sakit tinggal	0
laku racun guru sekolah hadap rekan nyinyir gadget pribadi bawa bantu kontra rekan bahas sekolah guru senior	0
alam kantor laptop	0
nyata ambil gaji pulang urus jahat sebal	0
bantu bimbang banget jujur alas pengin nalar manusia	0
jahat gaji rezeki	0
suka uang jahat bodo ganti duli sesuai kontrak lingkung asyik gaji libur bagus paket	0
negatif marah malas pergi teruk kaki bawang kipas susah gaji	0
dunia utuh berangkat pagi kantin kantor coba survey kota pusat kabupaten bekas	0
tanda verbal normal manager amik janji mungkir orang ambil kredit ramai orang tipu staff senyum pilih kasih	0
jahat gaji lampau sikit bonus kerah tenaga langsung bayar kena tahan maki rumah	0
arti usaha bilang jahat staff pakai jalur rekan lihat situ coba bokap bokap tegur suka	0
over late gaji kota panggar	0
punca timpal gaji kena tanggungjawab silap staff alam percaya bagus pangkat drama	0
habis tolak alas nasib omset cabang pegang sender capek banget cabang penuh orang jahat gaji pokok sender omset	0
jenis jahat tarikh gaji bayar sebar ambil elak rapat golong	0
dunia lari jahat kawan gila kawan kawan gaji sikit	0
atur buah usaha debat korea selatan usaha korea bikin atur kantor pagi sore karyawan smoking menit	0
jenis jahat tarikh gaji bayar sebar ambil elak rapat golong	0
negatif marah malas pergi teruk kaki bawang kipas gaji kaki bawang ubah perangai orang	0
pilih gaji juta kantor nyaman jenjang karir gaji juta kantor jahat jenjang karir gaji juta negeri libur	0
lingkung olah nikel rokok sedia langgar fatal langsung pecat bawa atur kejam urus pilih mati selamat	0
orang betah jahat lembur gaji ikhlas anjir kayak gaji bikin kayak ikhlas pulang malam nama	0
kasih gaji ganti orang jahat yayasan utang tinggal suami	0
negatif marah malas pergi teruk kaki bawang kipas gaji kaki bawang ubah perangai orang	0
cerita manila rapat minggu zoom manila kantor muak banget rapat cabut listrik kantor biar rapat putus maaf mati lampu	0
tinggal jahat gaji bayar	0
jahat gaji adem ayem gaji	0
umur lulus cari jahat umur lulus lihat cari gaji jakarta	0
kultur rumah sakit seringkali lebar relasi dokter awat bidan apoteker runyam dokter dokter apoteker resep obat cocok	0
paksa masuk pagi pulang malam buta hukum telat balas pesan menit paksa lepas alat kena sakit paksa tidur kaki tangan hilang	0
