teks	label_klaster
pandemik bayar gaji selesa relaks fikir henti henti pandemik benda henti	0
gaji cepat	0
pilih salah harga level tutup bawa gerbong rombong manjur pakai	0
bangun pagi semangat pergi tepu rutin gain mati situ gaji timpal	0
lompat mesti benda bagus sesuai gaji baca	0
enak ajar tumbuh serve pulang gaji pikir robot	0
ubah mentalitas malu telat wajib acara kantor urus pribadi debat manusia salah	0
cowok umur bumn gaji pegawai pilih swasta gaji pegawai kontrak coba cpns terima kasih alas	0
alas gaji bijak marah anak buah pulang tani rumah	0
jamin aman terima sesuai lolos alam tinggal nyaman usaha enak	0
kadang alas lucu pengin libur tanggal merah jaman kuliah kaya logis banget	0
efek gaji tingkat suka usaha daya tawar orang langsung ganti bisnis gerak cepat alas	0
alas orang gaji harga harga	0
usaha kaca lahir sedia ruang laktasi busui fleksibel busui perah jelek karyawan kecuali lembur	0
lihat jakarta gaji minat kecuali alas	0
efek gaji tingkat suka usaha daya tawar orang langsung ganti bisnis gerak cepat alas	0
karyawan bohong lamar arti nyaman tahan usaha usaha evaluasi sistem manajemen lihat elegan	0
alas kakak biar biar cepat nikah biar kayak bawa bareng biar hidup lepas jahat	0
dunia orang henti alas lelah gaji henti alas	0
alas motivasi rumah paksa laku jodoh gaji suka hidup sesuai nyaman gaji bonus	0
alas gaji jakarta gaji	0
pengin alas jarak jarak lumayan pengin rumah gaji rendah dilema	0
alas salah gaji kontribusi uang keluarga alas terima sang direktur peduli keluarga peduli usaha pergi	0
turun gaji alas rekan lingkung jahat banget bikin betah gaji turun lingkung alhamdulillah enak	0
curhat terima bidang gaji gaji ambil terima jakarta alas pengin gaji jenjang karir pengin alam	0
gaji alas pengin	0
teman manager pandemi tahan karyawan pikir karyawan rumah mending tutup gaji asih	0
tiada gaji urus beban wang sehat rupa faktor henti	0
durasi usaha alas tingkat gaji bidang	0
alas urgen tawar jahat orang loyal terima usaha kutu loncat	0
alas klasik gaji miris kelar strata kompromi ilmu coba salah kali coba	0
bayar juta begadang tidur come	0
cari gaji alas super valid	0
ramai henti gaji harga kawan jahat beban repek kebaji abai	0
kantor bikin gaji cepat strategi jangka buah utas perspektif usaha hadap	0
kantor lembur bayar pulang malam buah budaya haram hukum pulang pabrik pulang karyawan pulang ganti	0
lompat lompat relatif stabil cetak badai reda asik goreng gaji kena	0
teman rsud jawa jawa alas gaji sesuai beban sulit dokter dikit perata dokter problem	0
barusan teman cerita usaha jepang jaman kali alas loyal kutu loncat problem	0
alas pengin kasih orang suruh orang selesai masuk gaji	0
ramai henti gaji harga kawan jahat beban	0
dunia kantor salah pecat hilang gaji hilang nyawa tugas gaji enak	0
undang sabtu kondisi alas alas gaji	0
tingkat iring harap syarikat sistem gaji sesuai gaji	0
alas negara rana ambil ilmu alam salur malaysia kejar gaji kejar faedah gaya hidup	0
tingkat iring harap syarikat sistem gaji sesuai gaji	0
tips salah jenis pilih kasih salah bosan salah gaji kena potong lepas	0
acapkali arah tulis surat utara alami ketidakpuasan hati hadap skop jadual bayar gaji janji turun pangkat	0
omong mama alas gaji emak auto ceramah takut enak lupa jodoh	0
alas leluasa perintah agama gaji ubah	0
usaha minimal putus bilang kutu loncat alas jenjang karir fasilitas tara cari gaji	0
cerita orang pimpin cewek gaji digit kadang tembus uang bank alas masuk bank pakai gaji habis pegang suami info suami	0
pikir kayak orang wajar cari gaji bagus cari lingkung bagus alas orang malu pikir cetek	0
alas gaji	0
lupa alas alas gaji hapal	0
undang sabtu kondisi alas alas gaji	0
tawar sekolah posisi terima ajar sekolah kontrak kayak gaji pengin alas kepsek logis	0
alas bilang sesuai nyata utama kadang pagi malam pulang gila anak	0
salah alas utama orang kena gaji jenjang karir lingkung omong lingkung jelek bilang gaji jenjang karir usaha janji	0
wacana buah bibir sorot kerap pergok contoh	0
manfaat kondisi level karir usaha valid	0
tingkat iring harap syarikat sistem gaji sesuai gaji	0
tingkat iring harap syarikat sistem gaji sesuai gaji	0
kena tukar gaji kena lihat faktor peluang staf staf cuti kena angkut isteri angkut senarai	0
rumah cuti masuk staff jahat gaji komitmen takat	0
bikin rekening bohong alas gaji dikit kemarin	0
cewek pulang sore galak main sabtu masuk tanggal merah masuk jarak rumah kantor takut tanggap	0
lompat kenal kawan sorang lompat tukar tukar baju gaji	0
laksana patut kuat kuasa september tangguh cuti salin cuti minggu lepas raja putus pinda akta tangguh januari	0
staff bilang hati makan usaha coba cari susah jaman kayak dasar syukur entar	0
jawat awam putus henti nasihat henti alas sayang jamin takut niaga	0
henti cikgu posting jalan kereta jalan laut sekolah cantik budaya santai	0
ramai cakap zone gain basic bosan contoh pasal gaji pasal suka takut	0
gaji turun ribu alas betah	0
cewek gaji gaji turun persen alas putus	0
rekan gaji digit digit jabat rendah kontrak alas start stabil	0
terima kasih tawar salah alas minimal gaji tawar buka diskus moga timbang terima kasih	0
pengin alas gaji cuman lepas lingkung pikir	0
teman kantor utama cewek coba salah sender sender suka sebentar tinggal uang asuransi jamin cela	0
wajib alas gaji spekulasi jamin nyaman mending	0
bangun kantor masuk bangun keburu sarap kantor salah alas masuk posisi eksklusif	0
pengin alas kuat gaji jemput susah motor gampang susah gaji susah	0
karyawan pola pikir maaf rumah kapai daftar rumah kemarin terima gaji	0
halo sender kantor alhamdulillah langsung gaji kantor menang hasil	0
alas alas jahat rangkap	0
coba minimarket bang warnet kafe toko baju toko daging motel libur cuman tidur alas uang	0
guru gaji administrasi murid nakal wali murid rekan guru jahat	0
korban gaji juta paksa hidup gaji juta paksa cari laki suruh gaji	0
paksa modern bebas undur tunggu anggap tahan usaha wajib asih makan siang lembur minggu kasih kompensasi libur atur negeri manusiawi banding atur	0
cewek gaji aneh usaha salah over kasih gaji biar pikir capek ajar	0
cewek gaji putus libur gaji juta jujur badan toleransi	0
banget teman pilih dagang cilok alas bilang fleksibel mudah ibadah hasil gaji dagang	0
kemarin pusing pikir salah alas tolak tawar gaji	0
mama menang kangen adik bungsu qatar lulus bandung orang kasihan capek pulang tarik nafas gaji	0
alas bikin gaji jahat sesuai minat bahas versi hasil riset	0
wajar tukar gaji loyal gaji tengok contoh situasi	0
sorang adik komen nama hakim nama bang malas pergi esok kali tengok muka suka harga awak gaji	0
salah ajar perkara gaji jahat peluang pangkat tukar	0
kadang timbang orang rela gaji faktor jarak keluarga tinggal anak lingkung	0
omong gaji orang ambis tarik bahas gaji alas gaji coba usaha	0
utama masuk gaji pakai orang indonesia indonesia gaji habis hidup	0
ganti beda situ upah lembur gaji bpjs parkir bayar jarak tempuh ijin tunjang cair	0
ramai gaji harga kawan jahat susah situ repek kebaji abai jaga anak jaga sehat	0
alas obat bilang mantan rekan teman bilang mbak sepatu mall beliau manager region jateng mall	0
tolong resmi bank swasta lolos gaji moga putus karir riba	0
slogan sekolah kampung uang saku sekolah ajar riset tinggal sintas perempuan minggu lihat tangis sintas tahan dinamika henti salah	0
rumah kantor rekan ajar jalan doang tahan minggu habis alas niat susah	0
pulang malam subuh emak kasih alas cuman rumah rumah potensi malam	0
suruh pulang selesai kantor tutup artikel alas	0
terima langsung suruh banget tunggu proses banget allah nama alas gaji habis catat nomor	0
salah ajar perkara gaji jahat peluang pangkat tukar	0
alas hutan belantara produk nama nipis madu gaji kota	0
gaji lipat sesuai usaha jenjang karir jakarta transportasi ongkos jahat rekan kayak doang	0
alas cari gaji nafkah	0
alas alas percaya alas melulu gaji alas	0
jakarta gaji tawar mutasi ponorogo gaji jakarta ponorogo murah ambil	0
kayak rame generalisasi baca sisi positif kutu loncat posisi gaji	0
rekan usaha alas posisi situ	0
undang jujur tolong kasih referensi alas over	0
alas kantor jahat kantor gaji sesal terima kasih	0
paksa masuk pagi pulang malam buta hukum telat balas pesan menit paksa lepas alat kena sakit paksa tidur kaki tangan hilang	0
rela alas usaha banget rumah gaji ongkos transpor rupiah sesal enak	0
putus lingkung nyaman jenjang karir gaji jenuh banget kayak karyawan nyokap tuju takut	0
dunia dunia atur urus tinggal ijin omong sakit lampir surat ijin orang asih gaji	0
alas cuman gaji	0
entar ketemu teman gaji pikir saran syukur alas gaji teman dewasa	0
teman gede gaji susah hidup kapai susah alas orang biar gaji rendah	0
teman henti alas guru senior murid bandel banget sekolah negeri buah kota beban sesuai gaji	0
lihat pilih gaji opsi lingkung nyaman jarak pilih milik timbang kena	0
jamin aman terima sesuai lolos alam tinggal nyaman usaha enak	0
pilih salah harga level tutup bawa gerbong rombong manjur pakai	0
ubah mentalitas malu telat wajib acara kantor urus pribadi debat manusia salah	0
efek gaji tingkat suka usaha daya tawar orang langsung ganti bisnis gerak cepat alas	0
efek gaji tingkat suka usaha daya tawar orang langsung ganti bisnis gerak cepat alas	0
karyawan bohong lamar arti nyaman tahan usaha usaha evaluasi sistem manajemen lihat elegan	0
usaha kaca lahir sedia ruang laktasi busui fleksibel busui perah jelek karyawan kecuali lembur	0
alas salah gaji kontribusi uang keluarga alas terima sang direktur peduli keluarga peduli usaha pergi	0
bangun pagi semangat pergi tepu rutin gain mati situ gaji timpal	0
durasi usaha alas tingkat gaji bidang	0
jaman bisnis identik milik keluarga indak butuh struktur organisasi detail iring ubah jaman buah usaha milik milik saham	0
teman manager pandemi tahan karyawan pikir karyawan rumah mending tutup gaji asih	0
usaha kemarin lulus sekolah henti alas gaji tempo ketemu	0
alas urgen tawar jahat orang loyal terima usaha kutu loncat	0
baca kontrak usaha asih denda selesai kontrak kompetitor jujur alas cari	0
akak teman orang usaha nutrisi usaha alas kali lipat mantap	0
enak banget banget bosan astaga indah bego banget salah usaha alas gaji digit nyata bayar tanggung sanggup	0
bilang gaji lumrah alas usaha	0
gaji cepat usaha usaha syarat layak alas alas negatif	0
kantor bikin gaji cepat strategi jangka buah utas perspektif usaha hadap	0
jabodetabek wajar alias kutu loncat gaji daerah lapang batas rendah coba	0
lompat masuk masuk bonus kali tahan until	0
sesal suruh surabaya hidup jamin papa usaha rumah kendara bego banget pakai alas pisah teman suka yuda	0
lompat lompat relatif stabil cetak badai reda asik goreng gaji kena	0
salah alas suami gaji usaha sakit bpjs doang profit fasilitas alhamdulillah	0
barusan teman cerita usaha jepang jaman kali alas loyal kutu loncat problem	0
beban operasional usaha karyawan sesuai gaji biar beban operasional berat karyawan gaji ganti karyawan gaji	0
alas gaji wajar takut anggap loyal usaha anggap usaha gaji	0
usaha teman jamin capek nyaman alas orang	0
sejarah catat presiden sulit ekonomi negara utang potensi gusur warga lokal luas rusa kalimantan cenderung untung oligarki	0
undur massal usaha pandemi kondisi usaha stres pelik karyawan putus salah usaha karyawan pandemi	0
tips salah jenis pilih kasih salah bosan salah gaji kena potong lepas	0
alas utama semester stop guru honorer usaha hidup kayak orang kayak gaji kadar makan enak uang orang	0
usaha erti bingung pakai alas keluarga kota kayak alas niat susah langsung gaji cair	0
gantung kantor usaha beda usaha usaha alas mutasi beda beda ubah gaji ubah	0
lulus kuliah usaha cantum alas gaji daerah lingkung jahat	0
usaha jenjang karir gaji alas cari gaji	0
alas gaji lingkung jahat syukur gaji segi kualifikasi kompetensi usaha sesuai kesel bilang kayak kesal	0
salah alas utama orang kena gaji jenjang karir lingkung omong lingkung jelek bilang gaji jenjang karir usaha janji	0
manfaat kondisi level karir usaha valid	0
cari uang banget usaha kasih gaji kasih tenang batin alas pandemi kena imbas erti	0
usaha alas utama gaji perkara usaha alas urus	0
uang edar salah alas inflasi mangkanya gaji salah inflasi mangkanya gaji pilih usaha	0
kena tukar gaji kena lihat faktor peluang staf staf cuti kena angkut isteri angkut senarai	0
alas usaha gaji karyawan alas	0
cakap pahit teruk kedekut gaji buruk contoh alas henti	0
ramai henti gaji harga kawan jahat beban repek kebaji abai	0
singkat dunia khusus anak atur pengin umur pendek anak teman belah rekan	0
cerita pecat karyawan tonton bingung lucu marah	0
alas manual digital kudu harga negeri kurs murah digitalisasi pakai produk lokal jamin aman data usaha	0
usaha lokal indonesia prinsip wajar batas usaha gaji beda maksimal usaha harga upaya	0
hidup realitas ekonomi buah usaha rugi gaji direksi potong tekan usaha rugi karyawan penuh kait rantai pasok	0
susah usaha israel pribadi umkm gaji minimal turun drastis pasu turun usaha israel tingkat pecah rumah	0
alas sadar gaji lingkung salah bocil matahari buta dunia mending pikir usaha cari nyaman	0
kontra tuju fokus alas usaha stabil gaji stabil	0
zaman almarhum papa salah bank alas birokrasi susah capai usaha minim	0
sender coba lamar lamar usaha mending alas gaji telat bayar kantor susah akses kendara	0
biar usaha alas gaji	0
kontrak usaha gaji nyaman pengin alas	0
salah usaha bagus kantor salah asuransi kantor alas mulia gaji	0
manfaat buruh usaha hemat kali gaji orang alas upah minimum rendah	0
salah ajar perkara gaji jahat peluang pangkat tukar	0
paksa bayar gaji paksa laku usaha ganti rugi sisa kontrak wajib pasal ubah	0
kait kutu loncat manajemen loncat bikin gaji drastis baca kutu loncat rekomendasi kasih orang kandidat	0
awak tukar bidang salah bosan salah dengar gaji	0
salah ajar perkara gaji jahat peluang pangkat tukar	0
kadang nama paragon segani usaha mudah alas kasih tawar gaji lipat	0
kasir abdi usaha ujang alas ujang gaji bangladesh	0
kandidat lamar alas taraf hidup gaji lihat gaji juta usaha harap gaji	0
penasaran kandidat usaha alas utama gaji mentok kasih ruang mentok seru	0
uang usaha bawa kabur mantan manajer uang sisi manajer uang bawa kabur gaji bayar uang usaha buruk uang usaha buruk suka ambil uang usaha urus pribadi	0
putus duga bikin uang buruk apartemen cicil beban usaha salah kelola bisnis bayar apartemen gaji suka tarik uang	0
gara-gara alas gaji bonus usaha gaji sesal	0
kayak rame generalisasi baca sisi positif kutu loncat posisi gaji	0
rekan usaha alas posisi situ	0
arti alas kuat gaji bumn lihat gaji timbang masuk usaha bingung pakai terima kasih	0
rela alas usaha banget rumah gaji ongkos transpor rupiah sesal enak	0
masuk muncul paksa gugat kayak insentif gaji bayar janji kasih	0
efek gaji tingkat suka usaha daya tawar orang langsung ganti bisnis gerak cepat alas	0
kudap wajib lembur traktir	0
real alas teman bikin emosi malas jarang gaji uang makan jalan	0
alas gaji berat pengin rambut	0
rekan wanita alas program hamil anak banget jago desain	0
alas gaji nyaman lingkung teman kalimat indah kepsek	0
cari susah pandemi beban banget depresi samping gaji keluarga bilang sakit biar alas libur	0
alas cari kasih gaji auto sesal tinggal sesal	0
anak jaman bosan alas karir teman cuan gede	0
minggu pengin betah lingkung bingung alas	0
keren karyawan papa hamil cerita rumah alas kuat kantor papa kasih bijak gaji cuti lahir gaji papa kasih habis cuti lahir	0
slip gaji gaji sisa situ tulis hitung bayar potong arti hitung	0
utama alas gaji rekan laku kayak tahi	0
kudu rabi alas suami lembur rabi solusi	0
teman gaji lumayan alas lingkung cari coba pengin	0
alas turun lapang kadang malam lepas gaji pulang malam gaji standar keluh astagfirullah	0
teman angkat alas sedih bikin menang rekan teman angkat sedih	0
tolong kasih alas cocok kosmetik mall capek banget	0
sampah staff acah masuk alas gaji berkat kena	0
usaha kaca lahir sedia ruang laktasi busui fleksibel busui perah jelek karyawan kecuali lembur	0
alas malas pulkam ketemu tante kakak sepupu pokok anggota keluarga bagus kemarin lihat susah pandemi sabar sabar	0
manager pecat nyata busuk kirim lebay gaji tarik usaha	0
bidang minat suka pergi menang ambil putus henti tawar bonus	0
jujur dengar orang alas bosan lingkung gaji pengin lempar	0
efek gaji tingkat suka usaha daya tawar orang langsung ganti bisnis gerak cepat alas	0
alas kawan tawar loker mundur gaji pokok pagi pulang malam lembur partner jahat parah wajar	0
tiada gaji urus beban wang sehat rupa faktor henti	0
utama alas gaji rekan laku kayak tahi	0
alas jarak gaji	0
alas palsu alas asli gaji banding banget sistem jahat	0
wawancara usaha alas finansial gaji etis	0
lembur mesti rawat rumkit lelah kronis tipes teman bawa suka turun jabat sakit pilih auto kelimpungan	0
lolos rekan alas jujur butuh saran terima kasih	0
alas keren capek gaji	0
alas gaji sesuai cepat posisi	0
rencana gaji signifikan beban lembur bayar alas jelek usaha	0
gaji bonus kuat tinggal cari habis situ jerih payah usaha pandang belah mata	0
alas salah gaji kontribusi uang keluarga alas terima sang direktur peduli keluarga peduli usaha pergi	0
lambat insentif gaji pegawai utama nakes paksa	0
teman manager pandemi tahan karyawan pikir karyawan rumah mending tutup gaji asih	0
usaha capek gaji besok masuk langsung gaji	0
nyaman banget cocok lingkung gaji putus korea niat libur cari korona dasar menang	0
bayar juta begadang tidur come	0
ambil kena kantor alas kantor lingkung jahat gaji alokasi uang tahan kenal putus pilih	0
minggu sombong gara-gara sarjana lulus coba bangun komunikasi jelek teman cepu bodo sehat jiwa kayak robot	0
auto kafir shalat jumat barista restoran jepang mall tempel hotel mewah shalat jumat makan siang tinggal meja lantar	0
teman rsud jawa jawa alas gaji sesuai beban sulit dokter dikit perata dokter problem	0
ramai henti gaji harga kawan jahat beban repek kebaji abai	0
cakap surat tempoh moga bantu	0
alas kasih kagak lembur tugas manager	0
alas usaha rekan	0
prediksi tutup pecat total alas zona nyaman tolak lembur revolusi	0
habis gaji	0
karyawan gaji gaji gaji bikin resah paket jahat ganti lingkung asik	0
ramai henti gaji harga kawan jahat beban repek kebaji abai	0
gaji gaji gaji nilai bayar	0
masak kasir tamu gaji juta duduk sebentar istirahat manja	0
alas gaji banding beban	0
pengin alas gaji duit gilir susah bayar	0
gaji partner jahat masuk akal alas partner enak	0
gaji alas orang pribadi julid dendam bingung	0
undang sabtu kondisi alas alas gaji	0
alas cocok staf kontrak bilang alas alas peluang	0
lingkung gaji jenis alas biar terima	0
alas susah target gaji minim jujur usaha lamar	0
pergi gaji karut ungkit jahat	0
kayak alas rekan suportif	0
ramai henti gaji harga kawan jahat beban	0
paksa gaji bayar	0
alas masuk akal kadang tuntut loyalitas hitung lembur	0
gaji gaji pakai	0
tidur total laku stop bilang pengin alas capek	0
alas mental buruk kena penalti surat terang dokter rehat penalti banget juta banget balas	0
tingkat iring harap syarikat sistem gaji sesuai gaji	0
alas masuk akal kadang tuntut loyalitas hitung lembur	0
problem kena tolak gaji maki allah plan alhamdulillah	0
salah kuasa otak soak karyawan negosiasi gaji mandiri jejak nilai nilai tawar jual	0
alas jujur target gaji terima tawar kuat alas usaha mending kayak	0
cewek gaji jakarta gaji juta dapur listrik gaji juta alas bosan	0
cowok malas posisi jabat berat pilih alas pusing kayak malas gaji	0
gaji alas orang pribadi julid dendam bingung	0
libur gaji tunggu juta cari penjara kayak orang	0
alam maksud kutu loncat alas usaha kantor gulung tikar alas kantor cocok gaji	0
buka negoisasi gaji laku usaha bilang gaji usaha erti	0
tingkat iring harap syarikat sistem gaji sesuai gaji	0
acapkali arah tulis surat utara alami ketidakpuasan hati hadap skop jadual bayar gaji janji turun pangkat	0
tingkat iring harap syarikat sistem gaji sesuai gaji	0
minggu lancar kantor enak banget gaji jarak moga putus	0
tingkat iring harap syarikat sistem gaji sesuai gaji	0
contoh surat bahasa bahasa melayu kawan kawan	0
jawat awam putus henti nasihat henti alas sayang jamin takut niaga	0
jaman konten alas personal banget publik kecuali rawan	0
staff bilang hati makan usaha coba cari susah jaman kayak dasar syukur entar	0
ramai cakap zone gain basic bosan contoh pasal gaji pasal suka takut	0
gaji orang kena orang wajib bayar gaji	0
cakap pahit teruk kedekut gaji buruk contoh alas henti	0
cewek surat kasar lembur bayar bonus juta mending ikhlas tagih	0
siang obrol teman alas alas tahan mbak kantor ajar kantor relasi batas rekan	0
ramai henti gaji harga kawan jahat beban repek kebaji abai	0
prambanan jujur plan alas lembur pengin gaji potong bpjs	0
aman bilang alas cocok lingkung alas jujur gaji gaji	0
bilang kesan klise banget alas anggap adek anggap adek doang	0
habis tolak alas nasib omset cabang pegang sender capek banget cabang penuh orang jahat gaji pokok sender omset	0
coba lihat pesan situ uang cerita usaha	0
sebel gaji telat sebel lihat karyawan gaji telat pakai alas enak telat ambil cuti atur	0
minggu tuan putri labu bikin salah alas daerah blok	0
henti syarikat gaji salah sesuai sekira	0
karyawan pola pikir maaf rumah kapai daftar rumah kemarin terima gaji	0
pengin butuh uang alas capek anak jaman	0
konon pakai alas lepas gaji pangkat manager suruh masuk alas	0
istirahat rupa rupa istirahat bebas pakai kapai langgar hukum atur internal usaha bayar sangon	0
alas salah tidur beranta gaji minus potong	0
gaji alas enak	0
kawan budak gaji alas kursus pergi kursus kepala	0
marah kecewa pasang kuat lamar terima tolak gaji terima gaji	0
alas usaha sabtu cari senin jumat	0
gaji ambil tawar alas kontrak pinalti	0
halo sender kantor alhamdulillah langsung gaji kantor menang hasil	0
karyawan habis gaji henti kali karyawan alas klasik salah	0
cewek gaji nekat ganti fase capek banget gaji juta	0
paksa modern bebas undur tunggu anggap tahan usaha wajib asih makan siang lembur minggu kasih kompensasi libur atur negeri manusiawi banding atur	0
kakak sender banget gaji slip gaji potong jamsostek saldo kantor bilang arti bpjs gaji kakak sender sedih banget	0
lingkung enak gaji sedih banget paksa gaji butuh	0
gaji telat telat	0
guru gaji administrasi murid nakal wali murid rekan guru jahat	0
cewek gaji putus libur gaji juta jujur badan toleransi	0
alas klasik lingkung jahat jahat gaji cari alas bohong jujur tahan gaji	0
gara-gara rekan jahat susah ajak kerjasama tingkat hati banget hubung jujur alas pakai alas	0
gaji gara-gara susah cuti libur ganggu syarat gaji cuti ganggu	0
cari duit cari jenjang karir duit kayak sender alas normal gaji pikir tenang	0
alas bikin gaji jahat sesuai minat bahas versi hasil riset	0
tuju habis lulus cari gaji langsung minimal cari alam alas coba betah	0
usaha atur suka suka manager atur karyawan karyawan izin sakit dokter gaji desember	0
henti komitmen dana cemas utama komitmen alas fikir	0
coba alas pulang gaji tuntut rendah kayak	0
orang gaji rendah orang teruk gaji gaji	0
ramai gaji harga jahat beban repek kebaji abai	0
ganti beda situ upah lembur gaji bpjs parkir bayar jarak tempuh ijin tunjang cair	0
april kemarin alas sepeda keliling indonesia timur barusan banget telpon kepala toko gaji masuk pesan selesai jalan	0
alas rencana gaji rencana cari minimal suka	0
rumah admin data dada gaji suruh lantai angkat jemur jaga bayi utama bilang mental lemah	0
rekan surabaya tawar alas keluarga	0
ramai gaji harga kawan jahat susah situ repek kebaji abai jaga anak jaga sehat	0
gedik gedik buka staff bayar alas bayar gaji minggu bayar staff suara hantar surat saman bodoh	0
orang kantor niat masuk alas sakit mending imbas kasihan sakit kena potong sakit kadang rekan jabat kayak sampah bawa virus banget	0
bilang alas kuliah alas kuliah gila rodi istirahat mending duduk komputer	0
maaf bingung alas gaji sesuai bingung pikir alas saran alas	0
terima langsung suruh banget tunggu proses banget allah nama alas gaji habis catat nomor	0
tabiat usaha kali alas bagus gaji omong jelek jelek usaha	0
alas masuk akal jaman	0
alas gaji mantap fleksibel inti uang mantap	0
alas kuliah	0
alas rekan rekan bocor alias suka	0
jahat banget teman gaji alas penuh fakta lapang maksimal pulang gila gaji minim sulit	0
tolong resmi bank swasta lolos gaji moga putus karir riba	0
gaji banget biar jomplang rasai gaji kabur	0
cewek lingkung jahat kaya manusia kayak gaji salah bahasa binatang pusing cewek aduh putus	0
tetiba alas mesti jaga cucu anak terima banget hitung gaji suami bilang gaji penuh bersih untung suami hilang	0
banget coba kenal alam alas terima cerita alam capai alas	0
alas jahat uang lembur kena potong tanggal merah kena potong	0
niat ijin gaji alas capek kasih fasilitas kamar bobo alas asli ipar nafkah masak alas	0
cari ganti kaya usaha cari orang gaji kadang uang makan tunjang gaji	0
alas usaha bilang usaha bohong usaha gaji alam	0
undang jujur tolong kasih referensi alas over	0
cewek gaji gaji gaji tara anak langsung	0
cewek gaji alas gaji butuh apresiasi tugas undang seleksi	0
putus lingkung nyaman jenjang karir gaji jenuh banget kayak karyawan nyokap tuju takut	0
habis kontrak gaji mudah percaya gaji bentuk tulis kontrak ikat	0
pandemik bayar gaji selesa relaks fikir henti henti pandemik benda henti	0
gaji cepat	0
pilih salah harga level tutup bawa gerbong rombong manjur pakai	0
jamin aman terima sesuai lolos alam tinggal nyaman usaha enak	0
lompat mesti benda bagus sesuai gaji baca	0
arti enak pikir ayam sayur sesuai koridor kantor	0
enak ajar tumbuh serve pulang gaji pikir robot	0
ubah mentalitas malu telat wajib acara kantor urus pribadi debat manusia salah	0
bangun pagi semangat pergi tepu rutin gain mati situ gaji timpal	0
standar gaji gaji pintar	0
efek gaji tingkat suka usaha daya tawar orang langsung ganti bisnis gerak cepat alas	0
efek gaji tingkat suka usaha daya tawar orang langsung ganti bisnis gerak cepat alas	0
negatif marah malas pergi teruk kaki bawang kipas gaji kaki bawang ubah perangai orang	0
alas urgen tawar jahat orang loyal terima usaha kutu loncat	0
kenal start kondisi mental pengaruh fisik kena parah rawat inap operasi putus gaji alas pengin hidup mbak	0
